{
	"$schema": "../../../schema/table.json",
	"name":"Exam",	
	"description":"Examination",
	"columns": [
		{
			"name":"id",
			"type":"number"
		},
		{
			"name":"code",
			"type":"string",
			"size": 64
		},		
		{
			"name":"name",
			"type":"string",
			"size": 64
		},
		{
			"name":"examDate",
			"type":"datetime"
		}
	],
	"primaryKey": ["id"],
	"uniqueIndexes":{
		"CODE":["code"]
	},
	"nonUniqueIndexes":{
		"NAME":["name"]
	}
}